{
  "schemaVersion": "protocol-lab.tls-profile.v2",
  "profileId": "plab-tls13-chacha20-p256-server-auth-v2",
  "tlsVersion": "tls1.3",
  "serverName": "tls.plab.test",
  "alpn": "protocol-lab-tls",
  "cipherSuite": "TLS_CHACHA20_POLY1305_SHA256",
  "keyExchangeGroup": "x25519",
  "signatureScheme": "ecdsa_secp256r1_sha256",
  "peerAuthentication": "server-certificate-required",
  "certificate": {
    "profileId": "plab-single-leaf-p256-server-v2", "leafKeyAlgorithm": "ecdsa", "leafNamedCurve": "secp256r1",
    "dnsSubjectAlternativeName": "tls.plab.test", "sentCertificateCount": 1, "trustAnchorSent": false,
    "trustModel": "configured-test-trust-anchor", "mustBeValidAtExecution": true, "provisioningMeasured": false,
    "exactDerHashRequiredForComparison": true, "privateKeyPublication": "forbidden"
  },
  "evidence": {
    "negotiatedParametersRequired": true, "leafCertificateDerSha256Required": true,
    "clientCertificateDerSha256Required": false, "platformProvenanceRequired": true,
    "accelerationProvenanceRequired": true
  }
}
